{
  "$schema": "../../schemas/v3/harmony.v3.schema.json",
  "schemaVersion": "v3",
  "dataDir": "harmony",
  "meta": {
    "id": "realestate",
    "uuid": "a1e2f3b4-c5d6-4e7f-8a9b-0c1d2e3f4a5b",
    "name": "不動産仲介システム",
    "description": "ViewerScreenItem (#762) デモ用の最小サンプル。物件検索画面 1 つで物件マスタの一覧 / 詳細を viewer pattern で表示する構成のみを実装。顧客管理 / 内見予約 / 契約処理等の他業務軸は本サンプルのスコープ外。",
    "version": "1.0.0",
    "mode": "upstream",
    "maturity": "provisional",
    "createdAt": "2026-05-03T00:00:00.000Z",
    "updatedAt": "2026-05-03T00:00:00.000Z"
  },
  "extensionsApplied": [
    {
      "namespace": "realestate",
      "version": ">=1.0.0"
    }
  ],
  "techStack": {
    "designer": {
      "editorKind": "grapesjs",
      "cssFramework": "bootstrap"
    },
    "backend": {
      "language": "java",
      "framework": "spring-boot"
    },
    "database": {
      "type": "postgresql",
      "version": "17"
    },
    "frontend": {
      "library": "thymeleaf"
    },
    "auth": {
      "method": "session"
    },
    "deployment": {
      "target": "docker"
    }
  },
  "entities": {
    "screens": [
      {
        "id": "property-search",
        "no": 1,
        "name": "物件検索",
        "kind": "search",
        "path": "/properties/search",
        "maturity": "committed",
        "updatedAt": "2026-05-03T00:00:00.000Z",
        "hasDesign": true
      }
    ],
    "tables": [
      {
        "id": "property-master",
        "no": 1,
        "name": "物件マスタ",
        "physicalName": "properties",
        "category": "マスタ",
        "columnCount": 7,
        "maturity": "committed",
        "updatedAt": "2026-05-03T00:00:00.000Z"
      }
    ],
    "processFlows": [
      {
        "id": "property-search",
        "no": 1,
        "name": "物件検索",
        "flowType": "screen",
        "actionCount": 1,
        "maturity": "committed",
        "updatedAt": "2026-05-03T00:00:00.000Z"
      }
    ],
    "viewDefinitions": [
      {
        "id": "property-list-viewer",
        "no": 1,
        "name": "物件一覧",
        "kind": "list",
        "sourceTableId": "property-master",
        "columnCount": 6,
        "maturity": "committed",
        "updatedAt": "2026-05-03T00:00:00.000Z"
      }
    ]
  }
}
