{
  "$schema": "../../schemas/v3/harmony.v3.schema.json",
  "schemaVersion": "v3",
  "dataDir": "harmony",
  "meta": {
    "id": "household-budget",
    "uuid": "3a000000-0000-4000-8000-000000000001",
    "name": "家計簿アプリ (Household Budget)",
    "description": "個人向け家計簿アプリ。複数口座 (現金 / 銀行 / クレジット) を横断して日々の収支を記録し、カテゴリ別 / 月次の支出傾向を可視化する。設計者が新スキーマ (v3) のみを根拠に一から構築した先進的 UX 寄りサンプル — React + Tailwind + SQLite + NestJS。",
    "mode": "upstream",
    "maturity": "draft",
    "createdAt": "2026-05-24T00:00:00.000Z",
    "updatedAt": "2026-05-24T00:00:00.000Z"
  },
  "techStack": {
    "designer": {
      "editorKind": "puck",
      "cssFramework": "tailwind"
    },
    "backend": {
      "language": "typescript",
      "framework": "nestjs"
    },
    "database": {
      "type": "sqlite",
      "version": "3"
    },
    "frontend": {
      "library": "react",
      "framework": "next"
    },
    "auth": {
      "method": "jwt"
    },
    "deployment": {
      "target": "docker"
    }
  },
  "entities": {
    "screenGroups": [
      {
        "id": "household-budget",
        "name": "家計簿",
        "color": "#6366f1"
      },
      {
        "id": "master-management",
        "name": "マスタ管理",
        "color": "#10b981"
      }
    ],
    "screens": [
      {
        "id": "dashboard",
        "no": 1,
        "name": "ダッシュボード",
        "kind": "dashboard",
        "path": "/",
        "groupId": "household-budget",
        "maturity": "draft",
        "updatedAt": "2026-05-24T00:00:00.000Z",
        "hasDesign": true
      },
      {
        "id": "transaction-list",
        "no": 2,
        "name": "取引一覧",
        "kind": "list",
        "path": "/transactions",
        "groupId": "household-budget",
        "maturity": "draft",
        "updatedAt": "2026-05-24T00:00:00.000Z",
        "hasDesign": true
      },
      {
        "id": "transaction-create",
        "no": 3,
        "name": "取引入力",
        "kind": "form",
        "path": "/transactions/new",
        "groupId": "household-budget",
        "maturity": "draft",
        "updatedAt": "2026-05-24T00:00:00.000Z",
        "hasDesign": true
      },
      {
        "id": "category-management",
        "no": 4,
        "name": "カテゴリ管理",
        "kind": "list",
        "path": "/categories",
        "groupId": "master-management",
        "maturity": "draft",
        "updatedAt": "2026-05-24T00:00:00.000Z",
        "hasDesign": true
      },
      {
        "id": "monthly-report",
        "no": 5,
        "name": "月次レポート",
        "kind": "detail",
        "path": "/reports/monthly",
        "groupId": "household-budget",
        "maturity": "draft",
        "updatedAt": "2026-05-24T00:00:00.000Z",
        "hasDesign": true
      },
      {
        "id": "transaction-edit",
        "no": 6,
        "name": "取引編集",
        "kind": "form",
        "path": "/transactions/:transactionId/edit",
        "groupId": "household-budget",
        "maturity": "draft",
        "updatedAt": "2026-05-24T00:00:00.000Z",
        "hasDesign": true
      }
    ],
    "screenTransitions": [
      {
        "id": "tr-dashboard-to-new",
        "sourceScreenId": "dashboard",
        "targetScreenId": "transaction-create",
        "label": "取引を追加",
        "trigger": "click",
        "kind": "navigation"
      },
      {
        "id": "tr-dashboard-to-list",
        "sourceScreenId": "dashboard",
        "targetScreenId": "transaction-list",
        "label": "取引一覧へ",
        "trigger": "click",
        "kind": "navigation"
      },
      {
        "id": "tr-dashboard-to-report",
        "sourceScreenId": "dashboard",
        "targetScreenId": "monthly-report",
        "label": "月次レポートへ",
        "trigger": "click",
        "kind": "navigation"
      },
      {
        "id": "tr-dashboard-to-categories",
        "sourceScreenId": "dashboard",
        "targetScreenId": "category-management",
        "label": "カテゴリを管理",
        "trigger": "click",
        "kind": "navigation"
      },
      {
        "id": "tr-list-to-new",
        "sourceScreenId": "transaction-list",
        "targetScreenId": "transaction-create",
        "label": "新規追加",
        "trigger": "click",
        "kind": "navigation"
      },
      {
        "id": "tr-new-to-list",
        "sourceScreenId": "transaction-create",
        "targetScreenId": "transaction-list",
        "label": "保存して一覧へ",
        "trigger": "submit",
        "kind": "navigation"
      },
      {
        "id": "tr-new-to-list-cancel",
        "sourceScreenId": "transaction-create",
        "targetScreenId": "transaction-list",
        "label": "キャンセル",
        "trigger": "cancel",
        "kind": "navigation"
      },
      {
        "id": "tr-list-to-dashboard",
        "sourceScreenId": "transaction-list",
        "targetScreenId": "dashboard",
        "label": "ダッシュボードへ戻る",
        "trigger": "back",
        "kind": "navigation"
      },
      {
        "id": "tr-categories-to-dashboard",
        "sourceScreenId": "category-management",
        "targetScreenId": "dashboard",
        "label": "ダッシュボードへ戻る",
        "trigger": "back",
        "kind": "navigation"
      },
      {
        "id": "tr-report-to-dashboard",
        "sourceScreenId": "monthly-report",
        "targetScreenId": "dashboard",
        "label": "ダッシュボードへ戻る",
        "trigger": "back",
        "kind": "navigation"
      },
      {
        "id": "tr-list-to-edit",
        "sourceScreenId": "transaction-list",
        "targetScreenId": "transaction-edit",
        "label": "行 click で編集",
        "trigger": "click",
        "kind": "navigation"
      },
      {
        "id": "tr-edit-to-list",
        "sourceScreenId": "transaction-edit",
        "targetScreenId": "transaction-list",
        "label": "保存して一覧へ",
        "trigger": "submit",
        "kind": "navigation"
      },
      {
        "id": "tr-edit-to-list-cancel",
        "sourceScreenId": "transaction-edit",
        "targetScreenId": "transaction-list",
        "label": "キャンセル",
        "trigger": "cancel",
        "kind": "navigation"
      }
    ],
    "tables": [
      {
        "id": "user",
        "no": 1,
        "name": "ユーザー",
        "physicalName": "users",
        "category": "マスタ",
        "columnCount": 6,
        "maturity": "draft",
        "updatedAt": "2026-05-24T00:00:00.000Z"
      },
      {
        "id": "account",
        "no": 2,
        "name": "口座",
        "physicalName": "accounts",
        "category": "マスタ",
        "columnCount": 8,
        "maturity": "draft",
        "updatedAt": "2026-05-24T00:00:00.000Z"
      },
      {
        "id": "category",
        "no": 3,
        "name": "カテゴリ",
        "physicalName": "categories",
        "category": "マスタ",
        "columnCount": 8,
        "maturity": "draft",
        "updatedAt": "2026-05-24T00:00:00.000Z"
      },
      {
        "id": "transaction",
        "no": 4,
        "name": "取引",
        "physicalName": "transactions",
        "category": "トランザクション",
        "columnCount": 9,
        "maturity": "draft",
        "updatedAt": "2026-05-24T00:00:00.000Z"
      }
    ],
    "views": [
      {
        "id": "monthly-summary-view",
        "no": 1,
        "name": "月次集計ビュー",
        "physicalName": "v_monthly_summary",
        "maturity": "draft",
        "updatedAt": "2026-05-24T00:00:00.000Z"
      }
    ],
    "viewDefinitions": [
      {
        "id": "transaction-list-viewer",
        "no": 1,
        "name": "取引一覧 viewer",
        "kind": "list",
        "sourceTableId": "transaction",
        "columnCount": 6,
        "maturity": "draft",
        "updatedAt": "2026-05-24T00:00:00.000Z"
      },
      {
        "id": "category-list-viewer",
        "no": 2,
        "name": "カテゴリ一覧 viewer",
        "kind": "list",
        "sourceTableId": "category",
        "columnCount": 5,
        "maturity": "draft",
        "updatedAt": "2026-05-24T00:00:00.000Z"
      }
    ],
    "processFlows": [
      {
        "id": "transaction-create",
        "no": 1,
        "name": "取引登録",
        "flowType": "screen",
        "screenId": "transaction-create",
        "actionCount": 1,
        "maturity": "draft",
        "updatedAt": "2026-05-24T00:00:00.000Z"
      },
      {
        "id": "transaction-delete",
        "no": 2,
        "name": "取引削除",
        "flowType": "screen",
        "screenId": "transaction-list",
        "actionCount": 1,
        "maturity": "draft",
        "updatedAt": "2026-05-24T00:00:00.000Z"
      },
      {
        "id": "monthly-report-get",
        "no": 3,
        "name": "月次レポート取得",
        "flowType": "screen",
        "screenId": "monthly-report",
        "actionCount": 1,
        "maturity": "draft",
        "updatedAt": "2026-05-24T00:00:00.000Z"
      },
      {
        "id": "transaction-update",
        "no": 4,
        "name": "取引更新",
        "flowType": "screen",
        "screenId": "transaction-edit",
        "actionCount": 2,
        "maturity": "draft",
        "updatedAt": "2026-05-24T00:00:00.000Z"
      },
      {
        "id": "dashboard-data-get",
        "no": 5,
        "name": "ダッシュボードデータ取得",
        "flowType": "screen",
        "screenId": "dashboard",
        "actionCount": 1,
        "maturity": "draft",
        "updatedAt": "2026-05-24T00:00:00.000Z"
      }
    ]
  }
}
