{
  "$schema": "../../schemas/v3/harmony.v3.schema.json",
  "schemaVersion": "v3",
  "meta": {
    "id": "dogfood-puck-tailwind",
    "uuid": "d06f00d0-0001-4000-8000-000000000001",
    "name": "Puck × Tailwind dogfood サンプル (2026-05-05)",
    "description": "#806 子 6 dogfood。Puck エディタ + Tailwind CSS の組み合わせを検証するサンプルプロジェクト。お問い合わせフォーム画面で共通レイアウト props の WYSIWYG 操作を実証する。",
    "createdAt": "2026-05-05T00:00:00.000Z",
    "updatedAt": "2026-05-05T00:00:00.000Z",
    "mode": "upstream",
    "maturity": "draft"
  },
  "dataDir": "harmony",
  "extensionsApplied": [],
  "techStack": {
    "designer": {
      "cssFramework": "tailwind",
      "editorKind": "puck"
    }
  },
  "entities": {
    "screens": [
      {
        "id": "scr-contact-form",
        "no": 1,
        "name": "お問い合わせフォーム",
        "kind": "form",
        "path": "/contact",
        "maturity": "draft",
        "updatedAt": "2026-05-05T00:00:00.000Z"
      }
    ],
    "screenGroups": [],
    "screenTransitions": [],
    "tables": [],
    "processFlows": [],
    "views": [],
    "viewDefinitions": [],
    "sequences": []
  }
}
